{
  "schemaVersion": 1,
  "kind": "family",
  "id": "azure-devops:personal-access-token",
  "provider": "azure-devops",
  "name": "Personal access token",
  "description": "84-character PAT with a fixed AZDO signature at positions 76-80.",
  "lifecycle": "draft",
  "currentContract": "azure-devops:personal-access-token@1",
  "research": {
    "state": "researched",
    "researchedAt": "2026-09-23",
    "issues": [
      "redact-secret/redact-secret#298",
      "redact-secret/redact-secret#642"
    ]
  },
  "externalRefs": [
    {
      "system": "legacy-taxonomy-import",
      "id": "1020d2b5905e8973098235e57c4cdca3359bba57:benchmarks/support/dossiers/azure-devops.md",
      "url": "https://github.com/redact-secret/redact-secret-benchmarks/blob/1020d2b5905e8973098235e57c4cdca3359bba57/benchmarks/support/dossiers/azure-devops.md",
      "note": "families[id=azure-devops:personal-access-token]"
    },
    {
      "system": "legacy-taxonomy-import",
      "id": "1020d2b5905e8973098235e57c4cdca3359bba57:benchmarks/support/taxonomy.json",
      "url": "https://github.com/redact-secret/redact-secret-benchmarks/blob/1020d2b5905e8973098235e57c4cdca3359bba57/benchmarks/support/taxonomy.json",
      "note": "families[id=azure-devops:personal-access-token]"
    },
    {
      "system": "redact-secret-detector",
      "id": "azure-devops-personal-access-token",
      "note": "Legacy taxonomy.json detectors[] mapping, kept as an optional external reference."
    }
  ]
}
