{
  "schemaVersion": 1,
  "kind": "family",
  "id": "mongodb-atlas:database-user-password",
  "provider": "mongodb-atlas",
  "name": "Database user password",
  "description": "A database user's password for SCRAM-SHA authentication to a database in an Atlas cluster, chosen by whoever creates the user.",
  "lifecycle": "draft",
  "currentContract": null,
  "research": {
    "state": "researched",
    "researchedAt": "2026-10-04",
    "blockers": [
      {
        "kind": "documentation-gated",
        "summary": "The password is caller-chosen; the only documented structure is a minimum length of 8 and an 'alphanumeric' description."
      }
    ],
    "issues": [
      "redact-secret/credential-evidence#176"
    ]
  },
  "notes": "Project-authored by the Redact Secret project, which maintains this repository; not independent evidence. Draft; not yet reviewed."
}
