{
  "schemaVersion": 1,
  "kind": "family",
  "id": "trigger-dev:secret-api-key",
  "provider": "trigger-dev",
  "name": "Environment secret key (tr_ENV_ / tr_ENV_sk_)",
  "description": "tr_ + dev|stg|prod|preview + _sk_ + 24 [0-9A-Za-z] (additional), or tr_<env>_ + 24 or legacy 20 (root); pk_<env>_ public keys are not secrets.",
  "lifecycle": "draft",
  "currentContract": "trigger-dev:secret-api-key@1",
  "research": {
    "state": "researched",
    "researchedAt": "2026-09-28",
    "issues": [
      "redact-secret/redact-secret#860",
      "redact-secret/redact-secret#904",
      "redact-secret/redact-secret-benchmarks#434"
    ]
  },
  "externalRefs": [
    {
      "system": "legacy-taxonomy-import",
      "id": "ade8a10bd7922765110a68986b0690eb3861f2e5:benchmarks/support/dossiers/trigger-dev.md",
      "url": "https://github.com/redact-secret/redact-secret-benchmarks/blob/ade8a10bd7922765110a68986b0690eb3861f2e5/benchmarks/support/dossiers/trigger-dev.md",
      "note": "families[id=trigger-dev:secret-api-key]"
    },
    {
      "system": "legacy-taxonomy-import",
      "id": "ade8a10bd7922765110a68986b0690eb3861f2e5:benchmarks/support/taxonomy.json",
      "url": "https://github.com/redact-secret/redact-secret-benchmarks/blob/ade8a10bd7922765110a68986b0690eb3861f2e5/benchmarks/support/taxonomy.json",
      "note": "families[id=trigger-dev:secret-api-key]"
    },
    {
      "system": "redact-secret-detector",
      "id": "trigger-dev-token",
      "note": "Legacy taxonomy.json detectors[] mapping, kept as an optional external reference."
    }
  ]
}
