{
  "schemaVersion": 1,
  "kind": "family",
  "id": "asana:webhook-secret",
  "provider": "asana",
  "name": "Webhook secret",
  "description": "A shared secret Asana sends once in the X-Hook-Secret header during webhook establishment, used to compute HMAC signatures over later webhook deliveries.",
  "lifecycle": "draft",
  "currentContract": null,
  "research": {
    "state": "unresearched",
    "researchedAt": null
  },
  "notes": "Project-authored by the Redact Secret project, which maintains this repository; not independent evidence. Draft; not yet reviewed."
}
