{
  "schemaVersion": 1,
  "kind": "family",
  "id": "generic:connection-string-password",
  "provider": "generic",
  "name": "Connection-string password",
  "description": "Password embedded in a URI's userinfo component per RFC 3986.",
  "lifecycle": "draft",
  "currentContract": "generic:connection-string-password@1",
  "research": {
    "state": "researched",
    "researchedAt": "2026-09-26",
    "issues": [
      "redact-secret/redact-secret#651",
      "redact-secret/redact-secret#857",
      "redact-secret/redact-secret-benchmarks#365"
    ]
  },
  "externalRefs": [
    {
      "system": "legacy-taxonomy-import",
      "id": "ade8a10bd7922765110a68986b0690eb3861f2e5:benchmarks/support/dossiers/generic.md",
      "url": "https://github.com/redact-secret/redact-secret-benchmarks/blob/ade8a10bd7922765110a68986b0690eb3861f2e5/benchmarks/support/dossiers/generic.md",
      "note": "families[id=generic:connection-string-password]"
    },
    {
      "system": "legacy-taxonomy-import",
      "id": "ade8a10bd7922765110a68986b0690eb3861f2e5:benchmarks/support/taxonomy.json",
      "url": "https://github.com/redact-secret/redact-secret-benchmarks/blob/ade8a10bd7922765110a68986b0690eb3861f2e5/benchmarks/support/taxonomy.json",
      "note": "families[id=generic:connection-string-password]"
    },
    {
      "system": "redact-secret-detector",
      "id": "connection-string",
      "note": "Legacy taxonomy.json detectors[] mapping, kept as an optional external reference."
    }
  ]
}
