{
  "schemaVersion": 1,
  "kind": "family",
  "id": "elastic:serverless-project-api-key",
  "provider": "elastic",
  "name": "Serverless project API key",
  "description": "A personal API key created inside an Elastic Cloud Serverless project to call that project's Elasticsearch and Kibana APIs.",
  "lifecycle": "draft",
  "currentContract": null,
  "research": {
    "state": "researched",
    "researchedAt": "2026-10-06",
    "blockers": [
      {
        "kind": "documentation-gated",
        "summary": "Elastic describes one encoded representation and one response type for Elasticsearch and Serverless keys; only the issuance context differs."
      },
      {
        "kind": "issuance-gated",
        "summary": "Base64 alphabet, padding and part lengths would need an issued key, which is not created here."
      }
    ],
    "issues": [
      "redact-secret/credential-evidence#243"
    ]
  },
  "notes": "Project-authored by the Redact Secret project, which maintains this repository; not independent evidence. Draft; not yet reviewed."
}
