{
  "schemaVersion": 1,
  "kind": "family",
  "id": "langfuse:secret-key",
  "provider": "langfuse",
  "name": "Secret API key",
  "description": "Langfuse project/organization secret key as the issuer mints it: sk-lf- plus a lowercase UUIDv4 (42 characters). Paired with the public pk-lf- key.",
  "lifecycle": "draft",
  "currentContract": "langfuse:secret-key@1",
  "research": {
    "state": "researched",
    "researchedAt": "2026-09-24",
    "issues": [
      "redact-secret/redact-secret#726",
      "redact-secret/redact-secret#728",
      "redact-secret/redact-secret-benchmarks#221"
    ]
  },
  "externalRefs": [
    {
      "system": "legacy-taxonomy-import",
      "id": "1020d2b5905e8973098235e57c4cdca3359bba57:benchmarks/support/dossiers/langfuse.md",
      "url": "https://github.com/redact-secret/redact-secret-benchmarks/blob/1020d2b5905e8973098235e57c4cdca3359bba57/benchmarks/support/dossiers/langfuse.md",
      "note": "families[id=langfuse:secret-key]"
    },
    {
      "system": "legacy-taxonomy-import",
      "id": "1020d2b5905e8973098235e57c4cdca3359bba57:benchmarks/support/taxonomy.json",
      "url": "https://github.com/redact-secret/redact-secret-benchmarks/blob/1020d2b5905e8973098235e57c4cdca3359bba57/benchmarks/support/taxonomy.json",
      "note": "families[id=langfuse:secret-key]"
    },
    {
      "system": "redact-secret-detector",
      "id": "langfuse-secret-key",
      "note": "Legacy taxonomy.json detectors[] mapping, kept as an optional external reference."
    }
  ]
}
