{
  "schemaVersion": 1,
  "kind": "family",
  "id": "linear:oauth-access-token",
  "provider": "linear",
  "name": "OAuth access token",
  "description": "OAuth access token, prefixed lin_oauth_.",
  "lifecycle": "draft",
  "currentContract": null,
  "research": {
    "state": "not-found",
    "researchedAt": "2026-09-23",
    "issues": [
      "redact-secret/redact-secret#367",
      "redact-secret/redact-secret#642"
    ]
  },
  "externalRefs": [
    {
      "system": "legacy-taxonomy-import",
      "id": "ade8a10bd7922765110a68986b0690eb3861f2e5:benchmarks/support/dossiers/linear.md",
      "url": "https://github.com/redact-secret/redact-secret-benchmarks/blob/ade8a10bd7922765110a68986b0690eb3861f2e5/benchmarks/support/dossiers/linear.md",
      "note": "families[id=linear:oauth-access-token]"
    },
    {
      "system": "legacy-taxonomy-import",
      "id": "ade8a10bd7922765110a68986b0690eb3861f2e5:benchmarks/support/taxonomy.json",
      "url": "https://github.com/redact-secret/redact-secret-benchmarks/blob/ade8a10bd7922765110a68986b0690eb3861f2e5/benchmarks/support/taxonomy.json",
      "note": "families[id=linear:oauth-access-token]"
    }
  ]
}
