{
  "schemaVersion": 1,
  "kind": "family",
  "id": "vercel:app-access-token",
  "provider": "vercel",
  "name": "App access token",
  "description": "Modern Vercel App access token identified by the provider-documented vca_ marker.",
  "lifecycle": "draft",
  "currentContract": "vercel:app-access-token@1",
  "research": {
    "state": "researched",
    "researchedAt": "2026-09-29",
    "issues": [
      "redact-secret/redact-secret#1013",
      "redact-secret/redact-secret#516",
      "redact-secret/redact-secret#858",
      "redact-secret/redact-secret-benchmarks#367",
      "redact-secret/redact-secret-benchmarks#373",
      "redact-secret/redact-secret-benchmarks#473"
    ]
  },
  "externalRefs": [
    {
      "system": "legacy-taxonomy-import",
      "id": "ade8a10bd7922765110a68986b0690eb3861f2e5:benchmarks/support/dossiers/vercel.md",
      "url": "https://github.com/redact-secret/redact-secret-benchmarks/blob/ade8a10bd7922765110a68986b0690eb3861f2e5/benchmarks/support/dossiers/vercel.md",
      "note": "families[id=vercel:app-access-token]"
    },
    {
      "system": "legacy-taxonomy-import",
      "id": "ade8a10bd7922765110a68986b0690eb3861f2e5:benchmarks/support/taxonomy.json",
      "url": "https://github.com/redact-secret/redact-secret-benchmarks/blob/ade8a10bd7922765110a68986b0690eb3861f2e5/benchmarks/support/taxonomy.json",
      "note": "families[id=vercel:app-access-token]"
    },
    {
      "system": "redact-secret-detector",
      "id": "vercel-app-access-token",
      "note": "Legacy taxonomy.json detectors[] mapping, kept as an optional external reference."
    }
  ]
}
