{
  "schemaVersion": 1,
  "kind": "family",
  "id": "x:oauth2-user-access-token",
  "provider": "x",
  "name": "OAuth 2.0 user access token",
  "description": "The short-lived OAuth 2.0 user-context access token issued through the Authorization Code Flow with PKCE, sent as a Bearer token on behalf of a user.",
  "lifecycle": "draft",
  "currentContract": null,
  "research": {
    "state": "unresearched",
    "researchedAt": null
  },
  "notes": "Project-authored by the Redact Secret project, which maintains this repository; not independent evidence. Draft; not yet reviewed."
}
